report,audience,primary_kpis,why_this_report_exists,how_to_use_it
Executive Overview,"CEO, CFO, Head of Ecommerce","Revenue, margin, AOV, return rate, monthly trend, hero categories","Gives the quickest health check of scale, profitability and trading momentum.",Use first in interviews and board-style walkthroughs.
AI Commerce Command Center,"Executive team, BI Ops, Marketing, Merchandising","Next-best actions, agents, anomalies, category roles, channel efficiency",Shows the shift from passive reporting to intelligent operating rhythm.,Use to explain how AI agents can turn BI signals into actions.
ML Return-Risk Monitoring,"COO, Customer Experience, BI/ML team","AUC, recall, risk bands, risky categories/products",Demonstrates applied ML and shows where return leakage can be attacked.,"Use to position model as a watchlist, not a perfect oracle."
Marketing Growth Report,"CMO, Performance Marketing","ROAS, A/B uplift, SEO roadmap, competitor comparison, campaign calendar",Connects BI to revenue growth and Azure-credit discipline.,Use to justify scaling only after tests prove lift.
Accounting Governance Pack,"CFO, Finance Manager, Auditor","VAT, refunds, journal entries, SAP mapping, exceptions","Shows accounting-grade reconciliation, not just analytics storytelling.","Use to prove finance, SAP BW/SAP B1 and audit readiness."
ERD And Fabric Deployment Report,"Data Architect, BI Lead, Hiring Manager","Star schema, table grain, relationships, OneLake paths, pipeline proof",Explains how the data model is built and why it can scale.,Use to demonstrate senior architecture thinking.
Power BI Screenshot Pack,"Hiring Manager, Portfolio Reviewer","Executive, ML and marketing proof screenshots",Provides visual evidence even if the live tenant is not open.,"Use as quick proof in applications, interviews and email follow-ups."
Final Executive Dossier,All stakeholders,"Concise end-to-end story, screenshots, KPIs, handover and cost control",A leave-behind that consolidates the whole project into one polished artifact.,Use as the main portfolio attachment.
