Competitor,Positioning,Relevant categories,Strengths,Leatt opportunity,Source
Fox Racing,MX and MTB gear leader,"Helmets, boots, guards, goggles, gloves, race kits, apparel","Brand heat, athlete/race culture, category breadth","Leatt should lean harder into safety science, protection credibility, and South African origin story.",https://www.foxracing.com/moto.html
Alpinestars,Premium motorsport protection,"MotoGP, motocross, motorcycling, F1 safety gear, boots, gloves, apparel","Technical authority, motorsport heritage, premium protection halo","Compete with test evidence, fit guides, and protection-first product storytelling.",https://www.alpinestars.com/
100%,Performance eyewear and goggles,"Motocross, MTB, offroad goggles, sports sunglasses, helmets","Eyewear specialization, clarity/anti-fog/ventilation messaging","For Leatt eyewear, emphasize lens protection, riding conditions, and bundle with helmets.",https://www.100percent.com/pages/100-goggles
Oakley,Premium sport optics,"Cycling sunglasses, MX goggles, Prizm lens technology","Optical tech brand equity, virtual try-on, athlete credibility",Leatt must avoid pure optics battle; position eyewear as protection plus ride-specific value.,https://www.oakley.com/en-us/category/goggles/motocross
SCOTT,Bike and moto equipment,"MTB/off-road goggles, helmets, bike gear","Goggle depth, field-of-vision and anti-fog feature messaging","Use comparison content: Leatt vs Scott by lens, fit, helmet compatibility, price.",https://www.scott-sports.com/us/en/products/bike-equipment-mw-goggles
